{
  "id": "hardware.cpu.refurbished",
  "schemaVersion": 1,
  "name": "Refurbished CPU Servers",
  "description": "Second-life hardware. A fifth of the embodied carbon, and it fails more and draws more for the same work.",
  "researchId": "technology.environment.refurbishment",
  "family": "cpu",
  "generation": 1,
  "purchaseFactor": 0.45,
  "computeFactor": 0.85,
  "powerFactor": 1.15,
  "heatFactor": 1.18,
  "flexibility01": 0.95,
  "embodiedFactor": 0.2,
  "lifeYears": 3,
  "workloadAffinity": {
    "workload.streaming": 0.9,
    "workload.finance": 0.7,
    "workload.government": 0.7,
    "workload.batch_science": 0.9,
    "workload.disaster_recovery": 0.95,
    "workload.archive": 0.8,
    "workload.ai_inference": 0.35,
    "workload.ai_training": 0.2
  },
  "requiredCoolingKwPerRack": 6,
  "baseAnnualFailureRate": 0.11,
  "refurbished": true,
  "resaleValue01": 0.1
}
